{
  "schemaVersion": 1,
  "id": "hero",
  "name": "Procedural Hero",
  "profile": "humanoid",
  "frame": {
    "width": 128,
    "height": 128
  },
  "pivot": {
    "x": 64,
    "y": 90
  },
  "shadow": {
    "rx": 17,
    "ry": 8.5
  },
  "atlas": {
    "image": "hero.png",
    "data": "hero.json"
  },
  "animations": {
    "idle": {
      "frames": 8,
      "fps": 6,
      "loop": true,
      "directions": [
        "S",
        "SW",
        "W",
        "NW",
        "N",
        "NE",
        "E",
        "SE"
      ],
      "events": [],
      "footMarkers": {
        "S": [
          [
            {
              "id": "L",
              "x": 4.525,
              "y": 0.679,
              "contact": true
            },
            {
              "id": "R",
              "x": -4.525,
              "y": -0.679,
              "contact": true
            }
          ],
          [
            {
              "id": "L",
              "x": 4.525,
              "y": 0.679,
              "contact": true
            },
            {
              "id": "R",
              "x": -4.525,
              "y": -0.679,
              "contact": true
            }
          ],
          [
            {
              "id": "L",
              "x": 4.525,
              "y": 0.679,
              "contact": true
            },
            {
              "id": "R",
              "x": -4.525,
              "y": -0.679,
              "contact": true
            }
          ],
          [
            {
              "id": "L",
              "x": 4.525,
              "y": 0.679,
              "contact": true
            },
            {
              "id": "R",
              "x": -4.525,
              "y": -0.679,
              "contact": true
            }
          ],
          [
            {
              "id": "L",
              "x": 4.525,
              "y": 0.679,
              "contact": true
            },
            {
              "id": "R",
              "x": -4.525,
              "y": -0.679,
              "contact": true
            }
          ],
          [
            {
              "id": "L",
              "x": 4.525,
              "y": 0.679,
              "contact": true
            },
            {
              "id": "R",
              "x": -4.525,
              "y": -0.679,
              "contact": true
            }
          ],
          [
            {
              "id": "L",
              "x": 4.525,
              "y": 0.679,
              "contact": true
            },
            {
              "id": "R",
              "x": -4.525,
              "y": -0.679,
              "contact": true
            }
          ],
          [
            {
              "id": "L",
              "x": 4.525,
              "y": 0.679,
              "contact": true
            },
            {
              "id": "R",
              "x": -4.525,
              "y": -0.679,
              "contact": true
            }
          ]
        ],
        "SW": [
          [
            {
              "id": "L",
              "x": 2.24,
              "y": 2.08,
              "contact": true
            },
            {
              "id": "R",
              "x": -2.24,
              "y": -2.08,
              "contact": true
            }
          ],
          [
            {
              "id": "L",
              "x": 2.24,
              "y": 2.08,
              "contact": true
            },
            {
              "id": "R",
              "x": -2.24,
              "y": -2.08,
              "contact": true
            }
          ],
          [
            {
              "id": "L",
              "x": 2.24,
              "y": 2.08,
              "contact": true
            },
            {
              "id": "R",
              "x": -2.24,
              "y": -2.08,
              "contact": true
            }
          ],
          [
            {
              "id": "L",
              "x": 2.24,
              "y": 2.08,
              "contact": true
            },
            {
              "id": "R",
              "x": -2.24,
              "y": -2.08,
              "contact": true
            }
          ],
          [
            {
              "id": "L",
              "x": 2.24,
              "y": 2.08,
              "contact": true
            },
            {
              "id": "R",
              "x": -2.24,
              "y": -2.08,
              "contact": true
            }
          ],
          [
            {
              "id": "L",
              "x": 2.24,
              "y": 2.08,
              "contact": true
            },
            {
              "id": "R",
              "x": -2.24,
              "y": -2.08,
              "contact": true
            }
          ],
          [
            {
              "id": "L",
              "x": 2.24,
              "y": 2.08,
              "contact": true
            },
            {
              "id": "R",
              "x": -2.24,
              "y": -2.08,
              "contact": true
            }
          ],
          [
            {
              "id": "L",
              "x": 2.24,
              "y": 2.08,
              "contact": true
            },
            {
              "id": "R",
              "x": -2.24,
              "y": -2.08,
              "contact": true
            }
          ]
        ],
        "W": [
          [
            {
              "id": "L",
              "x": -1.358,
              "y": 2.263,
              "contact": true
            },
            {
              "id": "R",
              "x": 1.358,
              "y": -2.263,
              "contact": true
            }
          ],
          [
            {
              "id": "L",
              "x": -1.358,
              "y": 2.263,
              "contact": true
            },
            {
              "id": "R",
              "x": 1.358,
              "y": -2.263,
              "contact": true
            }
          ],
          [
            {
              "id": "L",
              "x": -1.358,
              "y": 2.263,
              "contact": true
            },
            {
              "id": "R",
              "x": 1.358,
              "y": -2.263,
              "contact": true
            }
          ],
          [
            {
              "id": "L",
              "x": -1.358,
              "y": 2.263,
              "contact": true
            },
            {
              "id": "R",
              "x": 1.358,
              "y": -2.263,
              "contact": true
            }
          ],
          [
            {
              "id": "L",
              "x": -1.358,
              "y": 2.263,
              "contact": true
            },
            {
              "id": "R",
              "x": 1.358,
              "y": -2.263,
              "contact": true
            }
          ],
          [
            {
              "id": "L",
              "x": -1.358,
              "y": 2.263,
              "contact": true
            },
            {
              "id": "R",
              "x": 1.358,
              "y": -2.263,
              "contact": true
            }
          ],
          [
            {
              "id": "L",
              "x": -1.358,
              "y": 2.263,
              "contact": true
            },
            {
              "id": "R",
              "x": 1.358,
              "y": -2.263,
              "contact": true
            }
          ],
          [
            {
              "id": "L",
              "x": -1.358,
              "y": 2.263,
              "contact": true
            },
            {
              "id": "R",
              "x": 1.358,
              "y": -2.263,
              "contact": true
            }
          ]
        ],
        "NW": [
          [
            {
              "id": "L",
              "x": -4.16,
              "y": 1.12,
              "contact": true
            },
            {
              "id": "R",
              "x": 4.16,
              "y": -1.12,
              "contact": true
            }
          ],
          [
            {
              "id": "L",
              "x": -4.16,
              "y": 1.12,
              "contact": true
            },
            {
              "id": "R",
              "x": 4.16,
              "y": -1.12,
              "contact": true
            }
          ],
          [
            {
              "id": "L",
              "x": -4.16,
              "y": 1.12,
              "contact": true
            },
            {
              "id": "R",
              "x": 4.16,
              "y": -1.12,
              "contact": true
            }
          ],
          [
            {
              "id": "L",
              "x": -4.16,
              "y": 1.12,
              "contact": true
            },
            {
              "id": "R",
              "x": 4.16,
              "y": -1.12,
              "contact": true
            }
          ],
          [
            {
              "id": "L",
              "x": -4.16,
              "y": 1.12,
              "contact": true
            },
            {
              "id": "R",
              "x": 4.16,
              "y": -1.12,
              "contact": true
            }
          ],
          [
            {
              "id": "L",
              "x": -4.16,
              "y": 1.12,
              "contact": true
            },
            {
              "id": "R",
              "x": 4.16,
              "y": -1.12,
              "contact": true
            }
          ],
          [
            {
              "id": "L",
              "x": -4.16,
              "y": 1.12,
              "contact": true
            },
            {
              "id": "R",
              "x": 4.16,
              "y": -1.12,
              "contact": true
            }
          ],
          [
            {
              "id": "L",
              "x": -4.16,
              "y": 1.12,
              "contact": true
            },